{
  "schema_version": "1.0",
  "profile_id": "v0.4-in-memory-5mib",
  "status": "frozen",
  "processing_mode": "in_memory",
  "max_normalized_input_bytes": 5242880,
  "semantic_strategies": [
    "simple_static",
    "region_filter",
    "complex",
    "support_article"
  ],
  "over_limit_disposition": "reviewed_planning_delta_required",
  "qualification_evidence": {
    "schema_version": "1.0",
    "path": "reports/v0.4/in-memory-capability-evidence.json",
    "sha256": "5a20d28f05d8b4a7a20c682caed0d914875fa255df47ef9f8d1bc9521f9517d8"
  }
}
